Anime,Recommendation,Reasoning,Recommendation Power
Maria-sama ga Miteru,"['Aria the Animation', 'Yagate Kimi ni Naru']","['-There are sempai-kouhai relationships between 3 girl groups.\r\n-They are beautiful slice of life that take you into their world and do not let you go.\r\n-Both protagonists are ""angels without wings"".', 'Same kind of premises, relationship between a senior with their junior with a specific reasons that tied them together. Light hearted, and if you like one, probably you will also like the other']","[1, 1]"
Dragon Ball Z,['Hunter x Hunter (2011)'],['Great anime with badass fight scenes'],[1]
Great Teacher Onizuka,"['Golden Boy', 'Gintama']","['Both protagonists are always up for a challenge and make learning and living fun for others', ""Onizuka and Gintoki are both the lowest person from Status quo's view but as a humans they are the best, they understand others' feelings and help them realize it. both are very very funny but when the time comes they become more serious then anyone else. In the end they both teaches us to leave according to our own will""]","[3, 2]"
Lodoss-tou Senki,['Slayers'],"['Both are classic fantasy anime that are inspired more by tabletop RPGs than JRPGs. The main difference is the tone. Slayers is a silly show that can occasionally be serious when it wants to, while Lodoss is a serious show that can occasionally be silly (though nowhere near as silly as Slayers) when it wants to.\r\n\r\nA common joke is  that Record of Lodoss War is the D&D campaign a DM wants to run, while Slayers is what most D&D campaigns actually end up being.']",[1]
Gintama,"['One Punch Man', 'Noragami', 'Kono Subarashii Sekai ni Shukufuku wo!', 'Detroit Metal City', 'Asobi Asobase', 'Shinchou Yuusha: Kono Yuusha ga Ore Tsueee Kuse ni Shinchou Sugiru', 'Space☆Dandy', 'Danshi Koukousei no Nichijou', 'Eizouken ni wa Te wo Dasu na!', 'Saiki Kusuo no Ψ-nan 2', 'Saiki Kusuo no Ψ-nan']","['Both protagonists are always up to make money, and they both teach you why defending others is a responsibility for the powerful', 'Both protagonists are now broken as fu*k and once they both fought in wars and now they abandoned the path of war and lead a fine life with their loved ones', 'Both anime have a group of friends who love and fight each other like familiy', 'Both have Non veg and vulgar comedic approach', 'Both have a similar comedic approach and people portrayal', 'Both are like a parody to their following genre, cautious hero parodies typical isekai anime and gintama parodies typical shonen anime, and both protagonist even though now powerful were once defeated and lost it all', ""The humor and randomness of these two series are so similar. Space Dandy is honestly just like an extra 12 episodes of Gintama with a different cast of characters. It's not just the comedy that's similar either, both series really deliver when it comes to the serious elements. If you're into all the comedy of Gintama you'll love Space Dandy and vice versa!"", 'This show is a must watch if you have seen enough anime and read enough manga. Its humour is similar to highschool boys.', 'Both Save World And Funny Three MC And Parody Gintama and Eizouken\r\nEizouken Story for school club\r\nGintama Story For Save World', ""More so than the first season, the second season of Saiki Kusuo includes short arcs in its storytelling that closely parallel that of the whole Gintama series. In general, both Season 2 of SK and Gintama feature similar storytelling, similar humor, and similar strengths in characters - particularly in each character's eccentricity, especially the main characters themselves. After all, both MCs basically have a show named after them :)"", 'It has the same type of stupid humor. Both have nice feels, but I definitely feel Gintama was way better than Saiki though.']","[1, 1, 1, 1, 2, 1, 1, 1, 1, 1, 1]"
Detroit Metal City,"['Sakamoto Desu ga?', 'Overlord']","['Both protagonists always win and in a cool way from continues attacks from their various haters and enemies', 'Both protagonists are treated like god from their followers but from inside they are clumsy and kinda foolish']","[1, 1]"
Tonari no Seki-kun,"['Asobi Asobase', 'Saiki Kusuo no Ψ-nan', 'Fumikiri Jikan']","['Both are about passing time in boring classrooms and both are very funny', '1. Both include a cast of characters that are all crackheads in their own ways.\r\n2. High school setting.\r\n3. Humor is the same in the sense that you will be rewatching and rewatching just to laugh over the same jokes.', 'Hilarious and slice of life. Very off-the-wall humor that matches this in oneshot pieces.']","[1, 1, 1]"
Tate no Yuusha no Nariagari,"['Itai no wa Iya nano de Bougyoryoku ni Kyokufuri Shitai to Omoimasu.', 'Shinchou Yuusha: Kono Yuusha ga Ore Tsueee Kuse ni Shinchou Sugiru', 'Vinland Saga', 'Arifureta Shokugyou de Sekai Saikyou']","['Both Protagonists are shielders\r\n\r\nDifference\r\nShield Hero is a bit dark and Bofuri is kinda childish but it has good animation', 'Both Protagonists personalities match each others, also they both are cautious with people because of the fear of loosing and being cheated', 'Both are about Innocent characters having to adapt to the brutal world around them because of some sort of tragedy', ""If you're struggling with Post Anime Depression from shield bro just watch this. This anime is fun but the story isn't as catchy. Has a very similar feel to shield hero, but it's more comedic and less serious""]","[1, 2, 1, 1]"
Doukyuusei (Movie),"['Asagao to Kase-san.', 'Given']","['Both movies unravel the lovestory of a same sex couple in a very realistic and gentle way. The couples go to the same school, and as the story goes on they face post- graduation stress and fear that they will part ways with one another.\r\n\r\nA really sweet and honest story about same sex relationships in highschool.', '- both follow a healthy relationship between young people\r\n- both shows use music as a catalyst that connects the characters']","[1, 1]"
Texhnolyze,"['Tenshi no Tamago', 'Ergo Proxy', 'Boogiepop wa Warawanai (2019)', 'Kino no Tabi: The Beautiful World']","['Both animes served with very little dialogue and has a very wide range of interpretation at the same time. Both shows have a great amount of symbolisms along the show. Last but not least, both shows are extremely well-written shows that talks about the critics of technology development (for Texhnolyze) and religious interpretation and acceptance (for Tenshi no Tamago).', ""Post-apocalyptic setting, gloomy mood, philosophical, cultural, and art references, quotes, symbolism, progresses extremely slowly, and you get confused often.\r\n\r\n(and if you dig either of these shows and don't mind reading, I suggest checking out Blame! the manga as well.)"", ""Both are very dark anime with a plot you have to keep paying attention too. Since if you don't you won't be able to keep track of the anime anymore. Made to make you think, directed at the adult audience. Surely Boogiepop and Texhnolyze will appeal the same people."", 'At first glance different, but: both are influenced heavily by philosophy and have a slow but natural pacing that gives plenty of time for the viewer to process the plot. Apart from that, both anime feature great atmosphere and ambiance (and in fact rely heavily on them); Texhnolyze especially, but Kino does not falter behind e.g in sound direction.\r\n\r\nAlso, the anime tells the events from a neutral perspective, in order for the viewer to make their own conclusions from what is presented. As a matter of fact, they are from the same season, Spring 2003.']","[1, 2, 1, 1]"
"""Bungaku Shoujo"" Movie",['Seishun Buta Yarou wa Yumemiru Shoujo no Yume wo Minai'],"['Similar tone, similar seasonal setting. Romance plot line. Light novel adaptation. Similarly nonsensical story that can still be enjoyed.']",[1]
Suzumiya Haruhi no Shoushitsu,"['Seishun Buta Yarou wa Yumemiru Shoujo no Yume wo Minai', 'Kimi no Na wa.']","[""Let's get one thing straight \r\n\r\nThe Disappearance is a masterpiece, no anime sequel film has ever or likely will ever touch the level of quality that it delivers. \r\n\r\nHowever, I get why people compare these two, they do have a similar tone, similar characters. If you want something like The Disappearance, you could do worse than this one."", 'As a romance story, i think its pretty same for me. And the plan to the time leap idea from the story really made this two movie seems so simmilar. I just always remembering all of this two same movie with slightly concept on everyday at my life.']","[1, 1]"
Masou Gakuen HxH,['Ishuzoku Reviewers'],"['Both shows share similar situations with their ecchi, in that they show full on portions (with some areas clipped out) of sex or sex-like scenes. In other words, they both are ecchi shows that very thinly borderline hentai']",[1]
Nogizaka Haruka no Himitsu,['Ore no Imouto ga Konnani Kawaii Wake ga Nai'],"['Both shows focus heavily on overall otaku culture, and they both centre around the central theme of ""prestigious lady is hiding her obsession over anime/manga culture""']",[1]
B-gata H-kei,"['Seitokai Yakuindomo', 'Midara na Ao-chan wa Benkyou ga Dekinai', 'Araburu Kisetsu no Otome-domo yo.']","['Both have very perverted female main characters. Although in B-gata the male and female MCs actually want to have sex with each other.', 'Looks like the Female main characters had the same romance issues here. Both of them pretty interesting to the perverted scene, yeah ecchiness for the win. No joke, they both denses with the definition of love, even gone wild without any other mind. What a b1tch. And their act to get the point were pretty much same! Just look, and feel what they feel. Not good for me, but its still fun to watch, only to feel embarased.', '-Where Otome-domo focuses more on drama B-gata H-kei focuses more on comedy in all the right places\r\n-both anime have main characters who are interested in sex']","[1, 1, 1]"
Koe no Katachi,['Kimi no Na wa.'],"[""Telling and loving are relative. Nobody care mistake. Stand up, children.\r\nBoth are legendary anime movies which released in same year. Despite different themes, really similar style.\r\nHowever, Koe no Katachi is more mature and heavy. Kimi no Na wa. is more romantic and touching. Nevertheless, great contents.\r\nYou'll love each Shouko and Mitsuha because they have established personalities. Both main characters are firm.\r\nI can't say more than this. Please watch them. If so, you can understand why they're masterwork. Thanks for reading.""]",[2]
Drifters,"['Dr. Stone', 'Dororo']","['These two are fundamentally different by plot and vibe, but there are few huge conceptual similarities, such as: \r\nadvanced inventions being revived and used strategically in a less developed world; \r\nmain cast establishes mutually beneficial relationship with locals, and passes knowledge to them;\r\nin order to defend against main antagonist, the cast has to gain as many allies as possible, and build up their own faction.', 'If you are a fan of violent and gory anime both of these will absolutely be up your alley. Besides that they also have some historical elements as well that I feel really elevate the experience of watching. While in a few ways they do have some key differences, which I do not want to say as they will spoil the show. Even with these differences they still have the same overall vibe of being ultra-violent and gore filled. I highly recommend!!']","[2, 1]"
Last Period: Owarinaki Rasen no Monogatari,"['Shachou, Battle no Jikan Desu!']",['Both come from smartphone games.\r\n\r\nBoth take place at a broken guild with adventures looking for money to re-establish the guild through silly adventures and ideas.'],[1]
B-Project: Kodou*Ambitious,['Argonavis from BanG Dream!'],"['Argonavis from BanG Dream! and B-Project: Kodou*Ambitious are both music styled anime that feature male characters singing Japanese pop songs. Both anime feature lively, and enthusiastic male characters that are passionate about their music, and performances. Both anime feature a primarily male cast.']",[1]
Marginal#4: Kiss kara Tsukuru Big Bang,['Argonavis from BanG Dream!'],"['Argonavis from BanG Dream! and Marginal #4! are both music styled anime that feature male characters singing Japanese pop songs. Both anime feature lively, and enthusiastic male characters that are passionate about their music, and performances. It also focuses on themes of friendship, and being in a group with other male musicians.']",[1]
Ensemble Stars!,['Argonavis from BanG Dream!'],"['Argonavis from BanG Dream! and Ensemble Stars! are both music styled anime that feature male characters singing Japanese pop songs. Both anime feature lively, and enthusiastic male characters that are passionate about their music, and performances.']",[1]
Darwin's Game,['Gleipnir'],"[""Similarities:\r\n\r\n1. The same character  plot where it has Shundere guy to Sadodere girl.\r\n\r\n2. The same story plot where guy got himself in a situation where life or dead is the name of the game.\r\n\r\n3. The same level of antagonist that the 2 MC have to deal.\r\n\r\nDissimilarities: \r\n\r\n1. Setting in one anime was more like a cyberpunk theme while the other one is more like monster battle kind of theme.\r\n\r\n2. One anime has the MC have a team while the other one only involves the 2 of them against other enemies.\r\n\r\n3. The Sadodere girl in one anime can really kick and blow an enemy's ass, while the Sadodere  girl in the other anime has to depend a lot on his Shundere partner to kick some ass.""]",[2]
Btooom!,"['Danganronpa: Kibou no Gakuen to Zetsubou no Koukousei The Animation', ""Darwin's Game""]","['Kill! or Die!\r\nSince their concept is same (Survival death game), they have many similarities. In Danganronpa, they are trapped in a highschool. As for Btooom!, the are trapped in a island. They have to kill to survive. Even if it means killing someone they love. In short, someone who likes either Btooom! or Danganronpa, would definitely like the other.', 'Both anime has people that forced into a survival game and genius protagonist with good skills and kind heart. Also both of them has thrilling, non-stop action with good animations.']","[1, 1]"
Beelzebub-jou no Okinimesu mama.,['Otome Game no Hametsu Flag shika Nai Akuyaku Reijou ni Tensei shiteshimatta...'],"['Both series are a parody of their genre but have different plots and settings. However, you might enjoy one if you enjoy comedy and fluffiness:\r\n- Both heroines were supposed to be evil but they are very cute and dense. They have a tendency to be gluttons. \r\n- Heroine has a stereotypical group of male and female friends to hang out with her.\r\n- Heroine is completely dense and oblivious to the feelings of the main ""hero"".']",[1]
Koukyoushihen Eureka Seven,"['Air Gear', 'Listeners', 'Boku no Hero Academia', 'Uta∽Kata']","['from the way I saw these two anime, both are similar because the MC sometimes find a way to breakthrough their problems, they also intend to find something new.', ""-Both are written by Dai Sato\r\n-Both are mecha anime\r\n-Both feature a fish out of water story about a boy meeting a girl in a backwater town\r\n-Girl has the means to make the Boy have a purpose in life \r\n-Adventure ensues\r\nEven the Mayor and Renton's Grandfather have a similar demeanor.  \r\n\r\nDespite Eureka Seven being over 10 years old, that show got better animation. oof."", ""the stories are completely different. the plots have nothing to do with each other. But the main characters are almost the same. Eureka 7's Renton is basically Izuku Madoria !0 years before MHA. The characterization, the movements and mannerisms, the voice acting. Its fun to see"", ""Both stories tell coming of age stories with great costume designs and distinct art styles. While they may initially seem different due to their wildly different genres (Uta~Kata being a magical girl anime and Eureka Seven being a mecha anime), both tie in the elements of their particular genres to help illustrate the main character's developments as they grow and mature, and share a similar progression where the first halves are a little slow and kinda meandering, with a tone that is somewhat lighthearted with an air of something more serious looming around the corner. The second halves of both shows delve right into that and are notably much darker, as well as being when they both become more streamlined and focused.""]","[1, 2, 1, 1]"
Medarot,"['Monster Farm: Legend e no Michi', 'Monster Farm: Enbanseki no Himitsu', 'Kodai Ouja Kyouryuu King: Yokuryuu Densetsu', 'Kodai Ouja Kyouryuu King']","['Both niche monster battling/taming kids anime.\r\nBoth have sentient creatures that ally themselves with human main characters, in both the monsters communicate with the heroes in the same human language.', 'Both classic and iconic yet niche monster battling anime.\r\nBoth have intelligent creatures who communicate with the human characters in the same human language.\r\nBoth have similar aged heroes and sense of humour.', 'Both are classic monster collecting kids anime series, both have intelligent creatures who communicate with main human heroes of each respective series. Both have great English soundtracks.', 'Both classic kids anime.\r\nBoth have revived ancient monster spirits.\r\nBoth have young children characters.\r\nBoth have companionship with the revived monsters and the kid characters.\r\nBoth have intense battles and wide varieties of monster designs.']","[1, 1, 1, 1]"
C: The Money of Soul and Possibility Control,"['Fugou Keiji: Balance:Unlimited', ""Darwin's Game""]","['Deals with money and the concept of capitalistic behaviors with mysterious characters interacting with the protagonist', 'The premise of both shows is nearly identical.\r\n\r\nA random average kid is forced to play a death game. That game turns out to have real world repurcussions. \r\n\r\nNo real point to either show, no overarching character goals or anything - just cool fight scenes']","[1, 1]"
Hello World,['Null Peta'],"[""Protagonists are using the virtual world to meet/help a person who's unavailable in the real world. Their quests both have plenty of adventures, heartwarming and heartbreaking moments. The overall tone is different though: Null Peta leans towards childish comedy at least in its first half, Hello World is more dramatic/realistic.""]",[1]
Mawaru Penguindrum,"['Sarazanmai', 'Boogiepop wa Warawanai (2019)', 'Magia Record: Mahou Shoujo Madoka☆Magica Gaiden (TV)']","[""Penguindrum is a one of a kind show. \r\n\r\nIkuhara's 'Sarazanmai' is the first thing since to achieve the same feeling. Glad to have him back."", ""Boogiepop And Other and Mawaru Penguin Drum have this dark, shrouded atmosphere that makes their worlds seem hopeless, unpredictable, and better off just letting the ''fate'' of their worlds take over. These shows have the power of taking people who seem so ordanairy and making their lifes a living hell, constantly fighting for what they want, even when they know that it may not come to light. The fate of the characters seems just about impossible to change...\r\n\r\nThe fantasy aspect, which usually makes a lot of shows more bright and loving, can make the worst darkness come out. The characters are out there for their own needs and won't stop to get what they want. While their causes seem reasonable, the boundaries that are pushed can be overwhelming, trying to change the outcomes of the people they care about. Also, the animation styles are both unique and bright."", ""Both these anime are pretty similar in the way that they both deal with the philosophy of fate and magical things happening to change it. They're also both completely not what you would expect. Madoka Magica is about magical girls in frilly outfits with a cute little animal thing, Mawaru Penguindrum involves a anthro-ish penguin hat, a cute little sickly sister who loves her big brothers, and adorable quirky penguins. How is that similar at all? Because they both seem really lighthearted and happy and deal with normally cutesy premises, but are actually shockingly dark Story""]","[1, 1, 1]"
True Tears,"['Yesterday wo Utatte', 'Kimi no Iru Machi']","[""Very similar character dynamics and atmosphere.\r\nBoth main male characters are dense. \r\nBoth have an eccentric, cute female character.\r\nI won't sugarcoat it. If you like shows with heavy drama, love triangles and can have the patience to see it through until the end then you should."", 'Both are about Love triangle chasing love and the complex selfish side of love']","[2, 1]"
Sora yori mo Tooi Basho,['Eizouken ni wa Te wo Dasu na!'],"[""Both shows involve a protagonist with a lofty goal, and the group of people she ropes in to help make the dream a reality. The series' revolve around how they can achieve and realize the goal, along with the antics the groups get into along the way. They both have a sense of adventure (though Sora yori more so) and and have theme of youthful hope and achievement.""]",[3]
Seishun Buta Yarou wa Yumemiru Shoujo no Yume wo Minai,['Hello World'],"['Both films deal with journies through multiple timelines with the goal of saving ones life, with romance included. They also both start off fairly understandable before becoming more complex/confusing later on']",[1]
Go! Go! 575,['Asobi Asobase'],['Both series have three girls as protagonists.\r\n\r\nSimilar characters\r\n\r\nEnergetic girl   »»»»» Hanako Honda »»Azuki Masaoka\r\nQuiet girl         »»»»»Kasumi Nomura»»Matcha Kobayashi\r\nBlond girl        »»»»»       Olivia        »»Tuzu Yosano'],[1]
Fate/Zero,"['Sword Art Online: Alicization', 'Fate/Grand Order: Zettai Majuu Sensen Babylonia', 'Juuni Taisen', 'C: The Money of Soul and Possibility Control', 'Drifters']","['SAO itself is very similar to Fate.\r\n- Both mix fantasy with very well animated action scenes.\r\n- Both, although they have elements of action, have an even greater focus on the dialogues and philosophies that surround the plot, although in Fate this philosophy is more Character-Focused, while in Alicization, it is more Theme-Focused.\r\n- Knights of Integrity are very similar to servants, especially in honorable speeches and backgrounds around their pasts and weapons.\r\n- And, above all, both OSTs are composed by Yuki Kajiura.', 'The whole concept of servants and holy grail is found in both the anime. Fate/Zero is a must watch if u just started fate series with Fate/GO Babylonia.', ""Both shows have similar character types; like Saber from F/Z and Sharyuu, both characters are looking for a way to save people through fairytale like means.\r\n\r\nObviously these shows are battle royals, but they never really feel like they are, Fate/Zero is more character and ideology driven, and where they then realize they're going to have to crush someone else's dreams in order to achieve their own.\r\n\r\nPersonal note; I think that if you loved Fate/Zero, then don't watch UBW, just don't. \r\n\r\nIf you loved Zero's top notch, meaningful fights, then I promise you, you'll love Juuni Taisen's."", ""Economy War and Holy Grail War. Not that similar, but the same overall message. Too much power = Bad, and you can't save everyone."", '- both shows are centered around historical figures who are summoned in the same time so they could fight in battle that could change the fate of the world.']","[1, 1, 1, 1, 1]"
Tonari no Yamada-kun,"['Osomatsu-san', 'Kaguya-hime no Monogatari']","['-both are about families where almost every member is an incompetent piece of sh-...an imperfect individual\r\n-both feature cynical humor but at the end of the day present some heartfelt moments and life lessons\r\n-both have sort of a crayon/drawing style and focus more on expressive animation than detailed art\r\n-both are very elaborate/well-produced anime based on classic, relatively simple manga', ""Both are directed by Isao Takahata, and feature a minimalist (but by no means cheap) and in fact very charming artstyle. \r\n\r\nAesthetically speaking, they are by far the more distinctive Ghibli movies, resembling a watercolor-style (as a matter of fact, Kaguya's backgrounds are indeed watercolor). \r\n\r\nTheir themes are also related to family: Kaguya-hime treats a sadder aspect of parenthood, that of parents clipping the wings off their children, whereas Yamada is a lighter comedy that nonetheless is still focused on a family with occasionally dysfunctional dynamics.""]","[1, 1]"
