Anime,Recommendation,Reasoning,Recommendation Power
Nurse Angel Ririka SOS,"[""Healin' Good♡Precure"", 'Tokyo Mew Mew']","[""These series share an awkward, dorky character with a heart of gold who is determined to help people, as well as a nursing and healing theme. Precure is much more modern, with more intense action, while NAR has a classic styled romance.  They're both soft, fun magical girl series!"", ""Cute middle school girls fight evil! They're cute, funny, and based on manga. The girls are awkward and in love, which isn't always reciprocated. But the unique aspect of both is their environmentalism - TMM focuses on Animal and Planet extinction and activism to stop it, while NAR focuses on pollution, global warming, and 'healing'.""]","[1, 1]"
Ping Pong the Animation,"['Mob Psycho 100', 'Eizouken ni wa Te wo Dasu na!', '3-gatsu no Lion', 'Devilman: Crybaby']","[""If you like quiet but thoughtful protagonists, an interesting and complex cast of characters, and beautiful fluid animation, these shows are top tier. The subject matter is very different but I think they're surprisingly similar."", ""Same director, both are about people doing what they are passionate about in their teenage years and both have that kind of quirky make you think plot. Overall if you like Eizouken you will probably like Ping Pong. It isn't as upbeat though."", 'Both explore the themes based around ""competition"" through amazing characters having different motivations, expectations from the respective games(Table Tennis & Shogi), where they end up & how they have to accept it & move forward. Both do this amazingly by having a lot of ""out of the court"" stuff, which developes characters & is exactly what makes the ""in game moments"" great. Both are beautiful & inspiring coming of age tales but while Sangatsu is slow paced, Ping Pong is fast paced.', 'They are both ambitious and risk taking anime that are made by the same director: masaaki yuasa']","[2, 1, 1, 1]"
Zetsuen no Tempest,"['Kyokou Suiri', 'Tokyo Ravens']","['- Narrative crafting in Suiri is very similar to the negotiation scene in the first half of Zetsuen.\r\n- Kotoko/Rikka rivalry very similar to the Aika/Hakaze rivalry.', 'The main characters have many similarities. \r\nAnd share many similarities both in the development of the plot and in that of the characters']","[1, 1]"
Lucky☆Star,"['Wotaku ni Koi wa Muzukashii', 'Slow Start', 'gdgd Fairies']","[""The light-hearted mood and comedy are similar in both anime, and Hirotaka reminds me a lot of Konata (they're both darudere video game otakus). \r\n\r\nWotaku has of course an element of romance that isn't present in Lucky, but both are very light, enjoyable watches nonetheless."", 'Both of these animes go good together, because they both take place in school, and both animes have 4 cute main characters.', 'Girls sat around a table talk about random subject matters that nobody cares about...or so you thought !']","[1, 1, 1]"
Ore no Imouto ga Konnani Kawaii Wake ga Nai,"['Wotaku ni Koi wa Muzukashii', 'Eromanga-sensei']","[""Both are rom-com animes about different kinds of otaku. They go to Comiket, Animate and do other anime-related things.\r\n\r\nI'd say both are pretty funny and light-hearted, not to mention relatable."", '- Same author\r\n- same verse (its character accidentally meets each other)\r\n- same genre (about siblings love)']","[1, 1]"
Little Witch Academia,['BNA'],"['It has a similar style...\r\n\r\nMore than an anime, it feels like a cartoon. Charming characters and a creative set-up. It is also from the same creator']",[1]
UFO Senshi Dai Apolon,"['Getter Robo', 'Uchuu Majin Daikengou']","[""Both of them are mid 70's anime about a giant robot that transforms from three different parts. Although UFO Senshi Dai Apolon is not a classic anime as Getter Robo is nor has the three different combinations and the interesting characters of Getter Robo, it's a decent watch."", ""Both of them are lesser known giant robo anime from the 70's with a prince from a foreign planet as a protagonist. Most of the enemies are animal/insect/fish etc. related designs and there is the typical drama/comedy involved as with most shows of the period.""]","[1, 1]"
Actors: Songs Connection,['22/7'],"['- Both are somewhat music themed anime that have a hint of realism to them + both have a big mystery that is only solved at the end. \r\n- Both MCs have dark-blue hair, are very down to earth and try to deal with their personal problems, all while being part of a music group.']",[1]
Houkago no Pleiades (TV),['Koisuru Asteroid'],"['Both story is about space, stars, and school girls The main characters are have some similar personality']",[1]
Onigiri,['Azur Lane'],"[""Both are anime based on games, Onigiri is however mini series meanwhile Azur Lane is made into full length anime series.\r\nGirls are main characters.\r\nThey both don't only focus on battles but also into character relationships.\r\nalsosomefanservicescenes""]",[1]
Kuroshitsuji: Book of Murder,['Id:Invaded'],['Both shows are inspired by Sherlock Holmes.\r\nBoth are really good murder mystery stories.\r\nBoth main characters think meticulously to solve the case.'],[1]
Koukaku Kidoutai,['Akira'],"[""Akira and Ghost in the Shell are both classic anime movies.  They have gorgeous animation, fantastic soundtracks, and intriguing (if not a little confusing) storylines.\r\n\r\nIf you enjoyed one of these films, then I can almost guarantee you'll like the other!""]",[1]
Yami Shibai,['Itou Junji: Collection'],"[""They both consist of short horror stories and they're both creepy. I recommend it for those reasons alone.""]",[1]
Gosick,['Kyokou Suiri'],['Both anime have a smart loli as an MC. Both are mystery with a splash of romance.'],[2]
Dantalian no Shoka,['Kyokou Suiri'],"['Both anime have a smart loli, accompanied by an older guy, as an MC. Both are mystery/fantasy.']",[1]
Top wo Nerae 2! Diebuster,"['FLCL Alternative', 'FLCL Progressive']","['Gunbuster 2/Diebuster is the true sequel to FLCL. Same studio and same director as FLCL and it has similar character designs and the same visual style. Also Diebuster is a perfect example of how to do a spiritual sequel to an older anime.', 'Gunbuster 2/Diebuster is the true sequel to FLCL. Same studio and same director as FLCL and it has similar character designs and the same visual style. Also Diebuster is a perfect example of how to do a spiritual sequel to an older anime.']","[1, 1]"
Yowamushi Pedal,['Haikyuu!!'],"['Both about sports (volleyball/cycling) Very realistic in the way the characters train, grow, make mistakes, and also work hard to achieve their goals. Funny too :) Great cast with interesting characters that grow on you, and you also learn lots about the sports too!']",[1]
Magia Record: Mahou Shoujo Madoka☆Magica Gaiden (TV),['Jibaku Shounen Hanako-kun'],"['""Hey! I\'ll tell you something: Apparently, these two anime share a similar concept! They both have people who hear rumors (which are represented by some sort of "" witches"") and try to find, even ""fight them"". ""Magia Record: MSMMG"" happens in a whole part of a city with Magical Girls, while ""Jibaku Shounen Hanako-kun""only happens in a school with a normal student. Simple has it is !\r\nThe atmosphere is more darker in the first one than the second one, but the second one has a particular aesthetic that we don\'t see much in other anime, making it a little more enjoyable than the first one.""']",[3]
Chobits,"['Hal', 'DearS', 'Nekopara', 'NHK ni Youkoso!']","['Both share the same essence and style. The main characters have many similarities. \r\nAnd share many similarities both in the development of the plot and in that of the characters', ""Both DearS and Chobits have a story featuring a main character that nobody knows much about. I'd say both could be considered romance, and they both have some Sci-Fi stuff.\r\n\r\nWithout a doubt, these two are what I would consider as classics of the new millennia.\r\n\r\nIf you liked DearS, you'll enjoy Chobits. I 100% guarantee it."", 'My opinion is that they are both OK shows but maybe a tiny bit pervy. If ya like one, ya like the other', 'Both series features a young male protagonist, having troubles realizing his own feelings and desires, spending alot of time in his room, and contemplating. Chobits lean more on the romance side, while Welcome to NHK - exploring more psychologically different characters, not only the main one, with their mental traumas.']","[1, 1, 1, 1]"
Yahari Ore no Seishun Love Comedy wa Machigatteiru.,"['Amagi Brilliant Park', 'Tate no Yuusha no Nariagari', 'Ore wo Suki nano wa Omae dake ka yo']","[""Both have the obligation of join into something that they don't want, and help other characters"", 'Edgy and disadvantaged MC with unique personality similar to Naofumi', 'Both ""My Teen Romantic Comedy SNAFU"" and ""ORESUKI Are you the only one who loves me?"" do a wonderful job in subverting the romantic comedy tropes that we typically see in anime. \r\n\r\nThere\'s only so many times the same old story can be told and manga writers themselves are starting to become aware of this. The self-aware commentary told by the main characters of both shows, Hachiman and Joro, is quite refreshing to see. While ""ORESUKI"" takes a more light-hearted comedic tone, ""SNAFU"" often takes a more serious route when analyzing relationships. That\'s not to say ""ORESUKI"" completely waves off the emotions of its characters but it doesn\'t fully acknowledge the repercussions of the choices each character makes like ""SNAFU"" does. Both shows are more productive with their relationships in the episodes given to them when compared to most anime of the same genre.\r\n\r\nIf you\'ve only watched either """"My Teen Romantic Comedy SNAFU"" or ""ORESUKI Are you the only one who loves me?"", I really recommend you watch the other as both shows complement each other and are very enjoyable.']","[1, 1, 1]"
Spiral: Suiri no Kizuna,['Rokka no Yuusha'],['Both contain a wide variety of characters.\r\nInvolves a mystery.\r\nSubtle romance between the protagonist and another character.\r\nBoth protagonists are incredibly intelligent.'],[1]
Tsurezure Children,"['Kaguya-sama wa Kokurasetai: Tensai-tachi no Renai Zunousen', 'Senryuu Shoujo', 'Araburu Kisetsu no Otome-domo yo.']","[""Interested in high school students trying to confess their feelings to their love? Or perhaps the wholesome couple moments may fill you up? If you liked Tsurezure Children's variety of relationships, then you may enjoy Shirogane and Shinomiya's interactions. Both are based on high school students who want to confess to the other. Tsurezure Children gives many personalities and different compatibility between young adolescences, while Kaguya-sama builds on a singular couple, both with amazing scenes and moments. Many situations and scenes in both series can change the atmosphere of confession or love, either for good or bad - resulting in a beginning of a relationship or never confessing or talking for a period of time."", 'Short episodes.\r\nBoth SoL romance with some comedy.', 'Tsurezure Children is a story about new couples, focusing on the romance and a comedy. A really heartwarming show with realistic characters and romances.\r\nAraburu is focused on 5 females characters, all very different in their personalities but also all iinterested in the discovery of love and sex. Drama and romance are both present, and the realistic events will make you feel a lot.\r\nIn all, these shows are similar with the multiples MC, romances and in the fact that these romances are all news but arrives somewhat early in the anime. They also both show realistic and logical romances and emotions.']","[1, 1, 1]"
Arslan Senki (TV),['Vinland Saga'],['Arslan as a character has a fair resemblance to Knut in later parts of the show. Themes are at times similar.'],[1]
Devilman: Crybaby,"['Dorohedoro', 'Banana Fish']","['Both of these anime have that gore-y and edgy vibe to them. They give you that same initial feeling.', ""Though Devilman Crybaby is a more supernatural anime, both show the darker side of humanity, are violent and gory, have 2 main characters who's relationship is a side plot, and both are guaranteed to make you ugly cry at the end.""]","[1, 1]"
91 Days,['Vinland Saga'],"[""Both are historical anime with main characters set on getting revenge. Both characters join the groups of people who they're set on getting revenge.""]",[2]
Sakigake!! Cromartie Koukou,['Danshi Koukousei no Nichijou'],"[""Both center around high school boys who happen to get into bizarre scenarios, and are put into awkward situations with the unlikeliest of people.\r\n\r\nBoth are based off of gag-manga, and both share similar styles.\r\n\r\nIf you're looking for something dumb, and bizarrely hilarious, I highly recommend this!""]",[1]
Genius Party Beyond,['Pianoman'],"[""Mahiro Maeda's Gala, the first short in the Genius Party Beyond collection, was a likely inspiration for Pianoman. Similarities can be found both in the overall feel and some of the major themes involved, such as music being presented as a source of life and/or growth.""]",[1]
Kuragehime,['Runway de Waratte'],"['Overview: Kuragehime follows a young woman who lacks self-confidence, but has a strong passion for Jellyfish after a trip to the aquarium as a child. After a chance meeting with a beautiful (cross-dressing) model, she slowly learns to accept herself and begins expressing her passion of jellyfish by designing clothes.\r\n\r\nSimilarities: Both Kuragehime and Runway de Waratte have a strong emphasis on following your passion and use clothes as the medium. Each show explores the idea of what makes people unique and beautiful, and takes the viewer on a complex emotional journey after the characters are taken out of their comfort zones through a chance encounter.\r\n\r\nDifferences: Kuragehime is slower paced, as the plot is driven more through character interaction and internal struggles instead of competition. The show also focuses on the path to finding clothes as the means of expression rather than the clothing design industry.']",[1]
Teito Monogatari,['Supernatural The Animation'],"[""Well animated, gritty, highly involved in the occult and on a larger scale. Worth a shot, but don't compare the anime to the tv series too much or you'll ruin it for yourself.""]",[1]
Hellsing Ultimate,"['Teito Monogatari', 'Kuroshitsuji: Book of Circus']","['Similar levels of edge in these two.', 'Ultimate and Book of Circus are both re-adaptations that follow the original manga arcs with very little to no deviation. This is in contrast to both the series original anime adaptations which only covered a small percentage of the manga and the rest of the show is anime original. Only difference is that Book of Circus does not cover the whole manga but rather a specific arc of the manga. Outside of that, both shows are similar because of the following:\r\n1) Both take place in England\r\n2) Both have a protagonist (Ciel and Integra) who makes a deal with a demonic figure (a vampire and actual demon) who are overpowered fighters with their own weapons.\r\n3) Both of them have butlers in them (Sebastian and Walter)\r\n4) Both series involve the main protagonists solving cases with their demonic servants on stand by for which the protagonist will command them to fulfill their demands.\r\n6) Both series have quirky and innocent servants outside of the Alucard and Sebastian who are also strong when they need to be. \r\n\r\n Bare in mind that both have their differences, particularly that Hellsing Ultimate is more of an  ultra-violent bloodbath in contrast to Black Butler: Book of Circus which is more light-hearted with its action but has its darker moments. However, if one is looking for series with similar stories and characters, look no further.']","[1, 1]"
Cardcaptor Sakura,"['Kill la Kill', 'Kanon (2006)']","['from one of the granddadies of girl transformations, sailormoon to cardcaptor sakura and many many more to the newskool inspired kill la kill, well thats part of anime alright.', ""Kanon and Cardcaptor Sakura are both slice-of-life anime with some supernatural/magical elements and a female lead with a lot of surprising similarities—said similarities include brown hair, a somewhat eccentric and child-like personality, an unusual sound for a catchphrase, a fear of ghosts, and a deceased mother. There's also a bit of charming romance in both.""]","[1, 1]"
00:08,['001'],['Both short animations that don’t make much sense'],[1]
Grappler Baki: Saidai Tournament-hen,['Kengan Ashura'],['Brutal tournament fighting without weapons. Variety of martial arts used and also explained during fights which is quite interesting. Doctors capable of resurrecting the dead and fighters with feats far greater than those of normal humans. Fighters making comebacks in fights despite all odds etc etc. Both shows even have a doctor participating in the tournament. Protagonist who wants to become stronger. Very similar shows. Kengan has more of a story line but I enjoyed the fights in Baki a bit more. (This season of Baki has the worst OP I have ever seen btw.)'],[1]
Paprika,['Id:Invaded'],"['-both involves dreams and dreams within dreams (if you watched Inception and you liked it, you may like this too)\r\n-involves investigations \r\n-one of those shows they label as ""mind-fcking""\r\n-""there\'s a fine line between reality and dreams""']",[2]
Oshi ga Budoukan Ittekuretara Shinu,['Zombieland Saga'],"[""Both series are idol anime with a twist/unique angle. If the traditional idol genre isn't for you, these two series might be a good entry point.""]",[1]
Uta∽Kata,"['Charlotte', 'Ano Natsu de Matteru']","[""Charlotte and Uta Kata both have a main character with brown hair who has shortly received a supernatural ability that involves borrowing sight (Ichika share the point of view of the Djinn she summons, while Yuu can borrow someone else's body for 5 seconds). The main character then meets a girl who has a supernatural ability of her own and asks the main character for their assistance. Despite how light both anime appear, they are both actually much more dramatic, with episodes showing the negative consequences that comes with the protagonist's new ability."", ""Both have summertime settings, and use that to tell a story in which a girl of mysterious origin appears, and shakes up the established dynamics of a group of a friends. In Uta~Kata it's more supernatural, whereas Ano Natsu is scifi, with the girl being an alien. Another difference is that Uta~Kata, the supernatural elements are used to help illustrate the coming of age themes, whereas in Ano Natsu, the scifi elements are more there to provide a little flavor to the drama""]","[1, 1]"
Tejina-senpai,['Sounan Desu ka?'],"['In both animes the main character is a girl obsessed with an original type of hobby, such as magic (""Tejina-senpai"") or survival (""Sounan Desu ka?""), and are showing it to the people around them. Stories of these animes are humorous. Also, both series are made of similar amount of episodes lasting around 10 minutes each.']",[1]
Chrome Shelled Regios,['Mahouka Koukou no Rettousei'],['OP protagonist. Multiple love interests. What makes me like these 2 series are that they both have more time to explore the relationship and bonding between characters (since the protag is already OP so nothing to see there).'],[1]
Cop Craft,"['BNA', 'Kyokou Suiri']","['Similarities:\r\n\r\n1. The same mystery and action genre.\r\n\r\n2. The same one older guy to younger girl kind of partnership.\r\n\r\n3. The same situation plot where it involves a bigger villain that the duo has to deal with.\r\n\r\nDissimilarities: \r\n\r\n1. Different futurist , where one is about mankind dealing with demi-human beast, and the other was mankind dealing with entities from an alternate world.\r\n\r\n2. Different female main characters attitude, where in one anime the girl is a kuudere/lesbina/air head, while in the other anime the main female character there was more of tsundere/airhead/bokuko.\r\n\r\n3. Different main guy attitude, where in one anime was very analytical but very cautions, while in the other anime the main guy there was very much aggressive, but a bit of a procrastinator.', 'Both animes are similar to the main characters, a couple who are investigating paranormal affairs. There are sympathies between Tilarna and det. Kei Motoba in Cop Craft and Kotoko Iwanaga and Kurou Sakuragawa in In/Spektre, but without showing impassioned feelings, they show this with their amusing dialogues and behavior.']","[1, 1]"
BNA,['Murenase! Seton Gakuen'],"[""Similarities:\r\n\r\n1. The same character whom were illustrated as Demi-humans.\r\n\r\n2. The same MC character plot where it involves the Mc finding a place to fit in...\r\n\r\n3. The same comedic element, where the MC gets into...\r\n\r\nDissimilarities:\r\n\r\n1. One anime is more on mystery and action, while the other one was more into comedy, ecchi and romance.\r\n\r\n2. One doesn't involve a human main character while the other one has the main human character.\r\n\r\n3. The MC in one anime was determine to get her humanity back while in the other anime the MC was determine to form a pack and get the human main character to like her.""]",[2]
Densetsu Kyojin Ideon: Hatsudou-hen,['Dragon Ball Z Movie 14: Kami to Kami'],"[""Unborn babies hold the key to humanity's salvation""]",[1]
Inu x Boku SS,"['Blend S', 'Kamisama Hajimemashita']","['Both female character got little bit similarities. And male character is obsessed with the female character.\r\nthe other side characters stories are funny.\r\nBlend s is a very funny anime. Inu X Boku SS anime got comedy too. Both anime got nice and funny story..', 'Although the anime is a bit different, they have a lot of similar things. Both anime portray a lonely girl moving into a new place of residence. A handsome man with tail and magic is waiting there. At the beginning the girl shows dryness and indifference but with time she falls in love with a fox-like man. Anime also contain an element of servant and supernatural powers.']","[1, 1]"
Pet,['Babylon'],"['You can expect some mind fucks, dark atmosphere of the world, killings and themes in life for mature people. Good vs Bad, technology and spiritual themes']",[1]
Ichigo Mashimaro,['Nichijou'],"['3 students with different characters: calm, stupid, and straight, nichijou is senior high school student while Ichigo is elementary school student']",[1]
Superflat Monogram,['Wonder Garden'],"['Each of these two short animes present a story of a little girl with great imagination who is using her imagination to create an unique world with elements from reality in bizarre roles in an instant. Both animes have pleasant art, smooth animation, soothing music and very limited plot, concentrating the whole idea of a show on showing how powerful is imagination of a child.']",[1]
Afro Samurai,['Ninja Batman'],['Afro Samurai and Ninja Batman Both Have \r\n\r\n-A mix of feudal Japan and modern technology\r\n-Production had connections to American influences (Batman and Samuel L. Jackson/Wu-Tang)'],[1]
Utsu Musume Sayuri,['Aki no Puzzle'],"[""Aki no Puzzle has A LOT of flashing lights and colours, so be warned. If you're high or drunk, you should absolutely watch these two back to back. Please watch your sanity levels if you're not one of those two. These are both creative masterpieces created by philosophers.""]",[1]
Dead Leaves,"['Kill la Kill', 'Promare']","['both have a thicklined drawing style and are over the top fun, and the style is also simmilair to the anime Redline', 'I guess this is the closest thing to a new Dead Leaves that has come out in recent memory. At least in terms of intensity and visual style.']","[1, 1]"
Chihayafuru,"['Kono Oto Tomare!', 'Runway de Waratte']","[""Both anime focus on a group of high school students playing traditional Japanese activities (koto music here and Karuta in Chihayafuru). A few other striking similarities they both have are beautiful animation, relatable characters, and overall very 'feel-good' positive energy."", 'Both series follow a strong willed female lead character who refuses to give up on their passion. Also the general layout and feel of both shows is rather similar: shounen-like setup of hardships and nice slice of life moments. Anyways if you are looking for something similar to Chihayafuru, Runway de Waradatte might just be it.']","[1, 1]"
Rinne no Lagrange,"['Machikado Mazoku', 'Senki Zesshou Symphogear']","['Both are series that largely focus on the bonding between female characters who are from different backgrounds/factions, and would seemingly be enemies, but overcoming that barrier to become close friends.', 'Both series have an MC who is thrust into a combat role due to an event in their past that allowed them to take upon the position (using a Gear for Hibiki and piloting a Vox for Midori), and focus on their relationships with their allies as they now fight to protect Earth. The Gear designs and pilot suits have somewhat similar designs as well.']","[1, 1]"
Magic Knight Rayearth,['Rinne no Lagrange'],['Both have a main cast consisting of 3 girls who become fast friends and fight to save/defend the world in giant robots.'],[1]
Gundam Build Divers,['Itai no wa Iya nano de Bougyoryoku ni Kyokufuri Shitai to Omoimasu.'],"['Both are light MMO anime that follow a pair friends as they dive into a VRMMO, make new friends to form a guild, and partake in in-game events to gain prestige for their guilds. While Build Divers and Bofuri may seem very different because one is a mecha MMO and the other is fantasy, both of the in-game worlds and communities have similar friendly vibes.']",[1]
