Anime,Recommendation,Reasoning,Recommendation Power
Made in Abyss,"['Shoujo Shuumatsu Ryokou', 'Kemurikusa (TV)', 'Yakusoku no Neverland', 'Hakumei to Mikochi', 'Kami no Tou', 'Somali to Mori no Kamisama']","['Both develop the theme of a post apocalyptic world, however even when Made in Abyss is presented to us as the cruellest story, it is, without a doubt, also the most accessible because Shoujo Shuumatsu invites us a little more to reflection due to its slower pace.', ""There's strong adventure game vibe to both of these, plus cute looking characters participate in a somewhat darkish story."", 'Both are dark anime, and have children being hurt bad', ""The third entry in the Great Potato Trifectia of 2017-18 (after Shoujo Shuumatsu Ryokou and Made in Abyss), Hakumei to Mikochi follows a grand tradition of potato anime: A small cast of absurdly cute characters, detailed setting with plenty of exploration and beautiful scenery, combination slice-of-life and adventure elements, great music and OST, and crucially, it's super comfy. Hakumei to Mikochi may very well be the comfiest anime ever: grab a blanket & curl up."", 'Both were done by the same music composer (Kevin Penkin) but I want to say all about the differences of two animes like:\r\nKami no Tou (Tower of God) in english is more darker than Made In Abyss\r\nTower of god is a korean manga adaptions and Made In Abyss is a japanese manga adaptions as well.', 'An adventure with a children looking for her parents, relaxing soundtrack and breathtaking sceneries, looks innocent and calm on the outside but story and action takes you by offguard.']","[4, 1, 5, 1, 1, 1]"
Tsuma Netori: Ryoujoku Rinne,['Tsuma ga Kirei ni Natta Wake'],['Similar animation \r\nBoth have nte'],[1]
Ashita Sekai ga Owaru toshitemo,['Hello World'],"['What you’ll first notice is the 3D animation. Both films use this style, and if you’re worried about it; just perish the thought. As most anime use 2D animation, it might seem new and alienating but you’ll get used to it. Both films have a lot of similarities. There’s the conflict with the alternate universe and the protagonist’s other self is his companion. The plot also revolves around twisting fate in order to be with the one they love. With Ashita Sekai ga Owaru toshitemo, it focuses more on the sci-fi aspect most especially on the second half. Of course, I wouldn’t miss out the bad-ass fighting scenes on this one.']",[1]
RobiHachi,['Kanata no Astra'],"[""sci-fi and comedy go hand in hand in both of these shows, though I most say that RobiHachi is much more on the comedy side than Kanata no Astra, and Kanata no Astra has a better storyline I guess ( both are comedies in the end and shouldn't be too fixed on the story anyways in my opinion), so in conclusion if you enjoyed the comedy aspect of Kanata no Astra you will definitely enjoy this one""]",[1]
Orenchi no Furo Jijou,['Kobayashi-san Chi no Maid Dragon'],"[""- Both revolve around an ordinary person finding an injured and or dying mythical being and takes them in\r\nas a way of help (well, MKDM's case is becasue of the power of being a drunk dumbass)\r\n\r\n- Both have a bit of a BL, well, this time a bit of a GL vibe\r\n\r\n- Like Orefuro, there are a variety of Sea Mon- I MEAN DRAGONS that show up throughout the series""]",[1]
Nichijou,"['Sakamoto Desu ga?', 'Joshikousei no Mudazukai', 'Kono Subarashii Sekai ni Shukufuku wo!', 'Hinamatsuri', 'Saiki Kusuo no Ψ-nan']","['Both are the funniest shows that i ever wathched.', 'The Three main characters are almost the same. We got the Idiot, The Smart but silent and the mangaka. Both are comedy anime set in a highschool.', ""If you find the humor of Konosuba funny, I really recommend Nichijou. It's a slice of life comedy with a unique art style"", 'Both are comedies about the daily life of young schoolgirls, with a few weird abilities thrown in here and there.', 'Same absurd humour, same kind of silly crazy frenzy taken to a whole other level, where every over-the-top idea is just getting crazier and crazier. Saiki Kusuo is much more fast paced though, and there is a somewhat real plot - at least, a final goal and some character development.']","[1, 1, 1, 1, 1]"
Love Live! School Idol Project,"['Cinderella Girls Gekijou', '22/7', 'Fuuka', 'Sora yori mo Tooi Basho', 'Re:Stage! Dream Days♪', 'BanG Dream!']","[""It's an idol slice of life, characters are awesome."", 'well for the starters they are both idol anime as you can already tell but have you ever thought that something is missing in the Love Live or why do they want to become idols well this anime will give you a ride of your life time more drama less kids more for us young adults so am trying so hard to not spoil anything about the story just trust me just jump in You will love it by the first episode....(P.S Myu best girl)', ""They're both really similar although one is a band, and another is a group of girls singing. Both are music anime :)"", ""We are going to Antarctica! Let's save our school by becoming idols!\r\n\r\nThese are the two very unrealistic sounding goals that groups of high school girls from these two anime have. \r\n\r\nBoth anime focus on friendship and journey of the characters who gathered together to reach their goal despite the opposition they might face. Both have fun character dynamics and generally positive atmosphere with plenty of comedic moments but also get more serious and dramatic at times."", ""Cute girls competing to become famous idols while dealing with their insecurities along the way. They're both fun and enjoyable anime especially if you like idols and music."", ""Both shows share similar premises, revolving around a group of girls who decide to create a music group on a whim. They both also share lots of similar plot points/drama, and tend to have 'unrealistic' developments to the plot\r\n\r\nThey also both share similar characters, with similar characteristics""]","[1, 2, 1, 1, 1, 1]"
Violet Evergarden,"['Arte', 'Carole & Tuesday', 'Kino no Tabi: The Beautiful World - The Animated Series']","['In Arte, the main character is also a woman aspiring to learn a trade, painting portraits of clients. In Violet Evergarden, the main character learns the trade of writing letters for clients. As they work for their clients, they learn about them, they gain respect for them, and they gain a friend.\r\n\r\nBoth are historical fiction taking place in a European setting. In either, there is a blossoming romance with someone they idolize, although in Violet Evergarden it is a side plot.\r\n\r\nCoincidentally, both shows are named after the main character.', ""They both have very in-depth stories that will tug at your heartstrings.Carole and Tuesday brings the idea that music is a key way to communicate to life,whilst Violet Evergarden reminds us that as nice as is it is to be able to send an instant message,there's something truly beautiful about being able to send a letter to someone,full of raw emotion and feeling.Two truly amazing anime's."", 'One of the prettiest animes I have ever seen.\r\n\r\nThe characters are all great, and the world feels very alive. It feels surprisingly chill, despite the backdrop of the war, and the trauma experienced by the MC. Violet herself is a very compelling character as well. The music is, as well, beautiful, and very fitting.']","[2, 1, 1]"
Goblin Slayer,"['Kimetsu no Yaiba', 'Dororo']","['-their similar ranking of hunters (adventurers in GS / Demon slayers in KNY) 10 ranks in both .\r\n-they are both about the protagonist hunting monsters as in demons or goblins for killing their loved ones.\r\n-even the names are similar (Goblin / Demon ) Slayer :)\r\n-Goblin slayer is more gruesome and gory than Demon slayer , but they are both not that disturbing if u ask me.\r\n\r\nall in all if u liked demon slayer i definetely recommend checking out goblin slayer ....', 'Both main characters are the silent and strong type\r\nBoth are determined to meet their end goal no matter how many times they fail without rest \r\nLots of gore \r\nInvolves demons']","[1, 1]"
Hunter x Hunter (2011),"['Mob Psycho 100', 'Kami no Tou', 'Jibaku Shounen Hanako-kun', 'One Punch Man', 'JoJo no Kimyou na Bouken (TV)', 'Kimetsu no Yaiba', 'Vinland Saga', 'Bungou Stray Dogs', 'Boku no Hero Academia', 'Radiant 2nd Season', 'Black Clover', 'Yakusoku no Neverland']","['I love hxh and while i watched Mob reminded me the meaning of friendship, and also the battles and the uniqueness on every esper, was nice :) (especial season 2)', 'similar in levels and tired competition system that leads to a great reward', 'Hanako-kun and Hunter x Hunter have young protagonists that experience adventures viewers could only dream of. Both series have fast paced action and good quality animation too.', 'Tournaments, different powerstyles and various heroes', ""Similar type of powe system yet the abilities are very unique and well used, both shows are fresh and don't have a cliche story"", '-Similar protagonist vibes and action due to them being both action shoujens\r\n-Main antagonists from both animes remind you heavily of eachother\r\n-Protagonists fighting powerful terroristic group with powerful enemies with unique abilities', 'Both are emotional stories with great characters and a lot of thrilling character development.', 'Both are built upon the idea of people who have some kind of unique ability, with someone who greatly overpowered; they also both share a strong male bond between at least two of the main characters.', 'Both series feature great arcs, and great characterization. Features kids facing difficult decisions and great battles. Also, both series, give the time to flesh out their antagonists, on top of their protagonists. Both series present great and compelling narratives, and are very enjoyable overall.', ""Like Seth in Radiant, Gon in HxH has a goal in his life that he's capable of everything to achieve it.\r\nYou'll get through all the character developpement of a weak Gon to a grow up and powerful character ! Very amazing to watch and you'll recognize similitudes in those 2 anime !"", 'The same character archetypes, Gon & Asta: Lovable and Stupid, Killua & Yuno: More Strength than the Main Characters, but less dominant personalities.\r\n\r\nThe Story plot is partially similar, for example, the Hunter Exam and the Magic Knight Exam.\r\n\r\nThe Art is similar as well, and with their never-gonna-give-up attitude, they eventually succeed.', ""Both have extremely talented children who far surpass the capabilities of your average child which opens them up to more dangerous side of the world that your average child would never see, as well the exposure to added danger it also gives them a great opportunity to explore parts of the world your average person isn't even aware exists.\r\nBoth shows have great senses of adventure and dark tones.""]","[1, 7, 1, 1, 1, 1, 1, 1, 1, 1, 2, 1]"
Omoide Poroporo,"['Rilakkuma to Kaoru-san', 'Otona Joshi no Anime Time']","[""Both the animes tell similar stories about life and how things can never stay the same throughout your life. The animes have different art styles yet had the same cozy vibes in my opinion. If you like one of them you'll probably like the other one!"", ""Both involve older Japanese women, often reminiscing on their pasts and their dissatisfactions in life; they often recount specific childhood memories, and trace these memories back to the person they'd become, abandoning the life they thought they should have been living for a new way of life that brings them true happiness. \r\n\r\n(they also both operate under a romantic slant!)""]","[1, 1]"
K-On!,"['Houkago Teibou Nisshi', 'BanG Dream!', 'Mitsuboshi Colors', 'Yuru Camp△', 'Itai no wa Iya nano de Bougyoryoku ni Kyokufuri Shitai to Omoimasu.', 'Koisuru Asteroid', 'Endro~!']","['Hina and Yui both get in to their clubs without knowing a lot about the subject matter. They both want  to leave the club at first but after trying they find out that both of them have a natural talent for their subjects and stay in the club. Also on their journey both the main character and the viewer learns  more about the subject and the characters. And as the series progresses both the viewer and the protagonist get more and more attached to  the subject and the characters.', ""Both of the anime is about music and the music is from a band. The anime is more like having fun and how's the band growing up from time to time. If you watch beetween one of these, i suggest you watch the other one since both of them is such a great anime ^^"", 'Both series are slice-of-life anime that are pretty comedic. While the girls in Mitsuboshi Colors do not play instruments, they have similar senses of humor and enjoy their life with very little drama. \r\n\r\nI would say Mitsuboshi Colors mixes the naughty-children humor from Calvin and Hobbes with the cute, playful attitude of the K-On band members, so if you are also a fan of both I would really recommend this show.\r\n\r\nAlso, it has a bright color palette similar to K-on, and a similar art style.', ""Cute girls doing cute things while not having a care in the world.\r\nThese shows are fun and cute slice of life shows with an all female main cast, a very relaxed atmosphere and most of all, THEY DON'T REALLY DO MUCH!!!\r\nBoth are shows that are easy to digest, no overly complicated story, no sci-fi elements, just pure slice of life and cute moe girls!\r\nYou can lay back, and watch them a cup of tea and some cake!"", 'Cute high school girls doing cute things. One involves an after school band club and one involves an all powerful immortal god being in a incomprehensibly unbalanced video game but they give off a similar vibe.\r\n\r\nIf you like one you will probably like the other.', '• Cute girls doing cute things.\r\n• Scholar club (K-on!: Music/Koisuru Asteroid: Geoscience).\r\n• Girls are always trying things to improve their club. Sensei is there to """"""help"""""" the girls. Also, members grow up and have to comfront situations that have impact on their future.\r\n• Characters design is cute in both series. It may even seem similar.\r\n• Both series have a good soundtrack.\r\n• Cute yuri moments. The girls transmit their love for each other and for what they\'re doing in their club.', ""I'm not going to sugar coat this but K-On is a lot better than endro overall. However, I do recommend endro if you like K-On just because of the fact that they both have likeable girls and comedy that will crack you up. Be warned that Endro only really picks up in terms of the story after episode 6 so if you aren't that patient then ignore this recommendation.""]","[1, 2, 1, 1, 1, 2, 1]"
Ginga Eiyuu Densetsu,"['Honzuki no Gekokujou: Shisho ni Naru Tame ni wa Shudan wo Erandeiraremasen', 'Future War 198X-nen', 'Code Geass: Hangyaku no Lelouch', 'Area 88', 'Sword Art Online: Alicization - War of Underworld', 'Uchuu Senkan Yamato 2199', 'Fate/Zero']","[""Much like Yang's obsession with history books, Myne is similarly obsessed with reading in general, and that drives them to accomplish many other things."", ""Politics and warfare from multiple perspectives. Pretty much the same exact thing as LoGH with a much shorter runtime, though there's probably more romance per capita in this movie."", 'they seem very much in the military part and with genius protagonists who use great war strategies to defeat their opponents, so are the battles in Ginga Eiyuu Densetsu and Code geass.We can also mention that the two have ideologies on each side that result in a great rivalry, something that also reminds me of the Death Note', ""LOGH and Area 88, while quite different in setting, have similar feel and themes. They're both 80s OVAs with a military setting. By being in OVA format, they don't shy away when showing violence, so there's plenty of blood to be seen. This does a good job of provoking the anti-war themes present in both. \r\n\r\nI really think if you like one you'd probably like the other, due to them being made in the same time period and their similar themes and characters."", '-Both contain plenty of politics, and well thought out war strategy.\r\n-Both have amazing soundtracks.\r\n-Both have amazingly written characters.\r\n\r\nWhile both are great, Sword Art is probably more well thought out.', ""both have classic feels and it's space opera after all"", 'The characters of both series embody unique philosphies and ideals, being pit against eachother in an ideological battle royale filled with multilayered strategies and sudden betrayals.\r\n\r\nIn Ginga Eiyuu Densetsu, several characters resemble real-life historical figures, while the cast of Fate literally includes reincarnated historical figures.']","[1, 1, 1, 1, 1, 1, 1]"
Manga Sekai Mukashibanashi,['Andersen Monogatari (TV)'],"[""Episodical omnibus of adaptations of various fairy tailes with the aesthetics of 70's animaton. While Andersen Monogatari adapts stories by Andersen and Manga Sekai Mukashibanashi has a wider range of origin of the stories, Manga Sekai Mukashibanashi still adapts mainly clasic western stories.""]",[1]
Mobile Fighter G Gundam,['Tengen Toppa Gurren Lagann'],['Both are great super robo shows'],[1]
Pupa,"[""Darwin's Game""]",['Both are so bad that they are good.'],[1]
Kenja no Mago,"['Hachi-nan tte, Sore wa Nai deshou!', 'Isekai Maou to Shoukan Shoujo no Dorei Majutsu', 'Watashi, Nouryoku wa Heikinchi de tte Itta yo ne!']","['A normal japanese working man gets reincarnated into the body of a child who has a high affinity for magic and becomes an overpowered magician.', 'isekai with overpower character that have trouble as one does understand just how overpowered he is and the other do to social anxiety. both go up against powerful foes in an otherwise light heated anime\r\n\r\nDemon lord MC his a neet that get summoned to a new world in the body with the skill, abilities and strengths of his MMORPG character. MC lives as an average adventurer and money is tight and is the dark of two anime with incest, rape and torture playing minor part of anime that should be noted. this is a harem anime with some ecchi \r\n\r\nWiseman MC is reincarnated as a baby and raise by a legendary hero and trained by him and two others in magic, enchanting and swordsmanship this with the limited memories and mind set from his old world allow Mc to become overpower and he fall for one girl at start', 'both are more light heart isekai anime with the MC dying by truck-kun and reincarnated. \r\nBoth MCs are extremely overpowered one thanks to a god and the other thanks to old world knowledge and legendary trainers in magic, magic item crafting and close combat \r\nBoth MCs are dense about their abilities and one somewhat socially awkward\r\ndifferences Watashi as some very dark undertones both have political drama and again Watashi had some family drama \r\nKenja as romance with the MC more or less falling for a girl right at the start while Watashi is center around a girl and her group of female friends questing as hunters (adventurers)']","[2, 2, 1]"
Peach Girl,['Skip Beat!'],"['Both Skip Beat! and Peach Girl are shoujo-styled dramas that have head strong heroines that stick true to their beliefs. The heroines overcome numerous obstacles and deception. Both anime feature characters that devote themselves to love, and romance.']",[1]
Danshi Koukousei no Nichijou,"['Ani ni Tsukeru Kusuri wa Nai!', 'Asobi Asobase', 'Joshikousei no Mudazukai', 'Grand Blue', 'Boku no Tonari ni Ankoku Hakaishin ga Imasu.', 'Saiki Kusuo no Ψ-nan', 'Gekkan Shoujo Nozaki-kun']","['Both are high school comedies, with three best friends as main characters.', ""It's a funny anime that somewhat have same vibes with Asobi Asobase. 3 main characters that are all crazy and best friends~"", 'literally the same show but the gender swapped', 'This is just a comedy anime and just looks on to fun students have in their college life.', 'they both have pretty short stories that are decently funny. I think \r\nBoku no Tonari ni Ankoku Hakaishin ga Imasu does it better though', 'Both shows focus primarily on life of High School boys and the challenges/comedic moments that they go through. They are also both broken up into mini shorts in each show so it is very easy to watch. Both have great laugh out loud scenes and are great watches whenever you are in the mood for some great comedy!', ""The comedy and the layout is really similar, although this one includes more romance! It's been a long time since Danshi Koukousei before I've laughed so easily.""]","[1, 1, 3, 1, 1, 1, 1]"
Sidonia no Kishi,"['Mushikago no Cagaster', 'Godzilla 1: Kaijuu Wakusei']","['Both involve humans facing a threat of another organism. The origin of both organisms is a deeper mystery involving a somewhat big conspiracy.', ""Extremely similar style of animation. The situation isn't massively different. Mecha isn't used in the same way but is included. The show looks very much similar with an old ship that left the system seeking a new home with a run down look. Romance in this however is very low on the scale of what is done but that is because it is more about fighting for a home.""]","[1, 1]"
New Game!,['Kobayashi-san Chi no Maid Dragon'],"['> Both are slice of life shows\r\n> Both have a heavy emphasis on characters and comedy\r\n> Both have characters that change over time, and heartfelt moments\r\n> Both have a mostly female cast']",[1]
Toki wo Kakeru Shoujo,"['Kimi no Na wa.', 'Colorful (Movie)', 'Kimi to, Nami ni Noretara', 'Ookami Kodomo no Ame to Yuki']","['Both movies have similar characters, and both mc deal with supernatural events.', 'both have the  same style of animation', 'Both bittersweet endings, pretty animations, romance, scifi? fantasy i guess? (theres a weird water boyfriend ghost ) (no time travel tho).', 'this one was made by the same director, the same art style and youll laugh with the characters, but when thing is gonna be serious youre gonna cry, these films have phylosofical questions about the who and the what to do, youre gonna enjoy this.']","[1, 1, 1, 1]"
Shingeki no Kyojin,"['Bungou Stray Dogs', 'God Eater', 'Koutetsujou no Kabaneri', 'Yakusoku no Neverland', 'Kami no Tou', 'Owari no Seraph', 'Dorohedoro', 'Vinland Saga', 'Tokyo Ghoul']","['- Same sort of team dynamic with slightly op mc', '-Similar concepts (Humans driven into walls by seemingly unstoppable creatures)\r\n\r\n-Strong-willed protagonists\r\n\r\n-Government secrets\r\n\r\n-Reliable captains!!', 'After watching this epic show shingeki no kyojin (Attack on titan) I was searching for something similar and going by the recommendations and checking them out.\r\nKoutetsujou no kababeri is the closest and have got lots of similarities.\r\nIts the best possible anime similar to Attack on titan and even both the shows are directed by the same director.', 'The enemy forces are unknown creatures without a clear origin ,with the traitors everywhere,The environment is isolated from the other world', '- Mystery-centric plot that is very well planned ahead\r\n- Characters took classes, joins society, fights the establishment and wars\r\n- MC grows psychologically throughout the series\r\n- Great worldbuilding, great side characters \r\n- Relatively serious narration with some humour \r\n- No ecchi, powerful and important female characters', '- Both have main characters that has a special ability.\r\n- Both main characters loses someone that is important for them, and they both want revenge.', 'Both (Manga and all seasons included) have a similar story line. Both have amazing antagonists and protagonists (where you can really root for either side) and both have great writing.', '-darker stories and worlds\r\n-same studio (Wit Studio)\r\n-both are somewhat grounded in history (German architecture and Nordic Vikings and combat)\r\n-have likable side characters\r\n-protagonists who want revenge', ""Great dark stories that aren't afraid to show gore.""]","[1, 1, 4, 2, 1, 1, 1, 1, 1]"
Buzzer Beater,"['Kaiba', 'Yojouhan Shinwa Taikei']","['While BB does not explore everything that may be as most other sci-fi do (e.g. Kaiba, about memories, but then again how tall players are is more relevant than their memories in a game), it is still very much solidified as a background in its multitudes - architectural sci-fi, if such a genre were to exist.', ""What is apparent from watching BB is that decisions were made to contrast the hues in the anime; protagonist's blue, so his opponent's red, but that doesn't stop there at all as even environments are usually one or another, kind of like how in Tatami Galaxy one hue is more likely to envelop most others, except in BB they're more 'solid', more bright (as even street lights are), and this presumably was made so life could be felt emanating from, mainly Hideyoshi, but also societies at large.""]","[1, 1]"
